date,product,feedback_text,rating
2023-01-05,Product A,"배송이 정말 빨랐고 제품 품질도 아주 만족스럽습니다. 다음에도 또 구매할게요!",5
2023-01-06,Product B,"사용하기가 좀 어렵고 설명서가 불친절하네요. 개선이 필요합니다.",2
2023-01-07,Product A,"디자인은 예쁘지만 기능이 기대 이하였습니다. 가격에 비해 아쉽네요.",3
2023-01-08,Product C,"아이디어가 좋습니다. 하지만 아직 버그가 좀 있는 것 같아요. 수정되면 완벽할 듯.",4
2023-01-09,Product B,"고객 서비스가 정말 친절했어요. 문제 해결도 신속하게 해주셔서 감사합니다.",5
2023-01-10,Product A,"평범합니다. 특별히 좋지도 나쁘지도 않아요.",3
2023-01-11,Product C,"너무 좋아서 친구들에게도 추천했습니다!",5
2023-01-12,Product B,"이건 정말 최악입니다. 돈이 아까워요.",1
